{
  "schema_version": "1.0.0",
  "snapshot_id": "MF-FORMAL-SNAPSHOT-FC-GDM-001-RH-NS-PILOT",
  "source_lock_id": "MF-FORMAL-FC-GDM-001-LOCK",
  "source_id": "FC-GDM-001",
  "source_repository": "google-deepmind/formal-conjectures",
  "source_commit": "85f863718beeec7b58a3a1926ee92e3472bc2020",
  "scope": {
    "scope_id": "RH-NS-PILOT",
    "paths": [
      "FormalConjectures/Millenium/RiemannHypothesis.lean",
      "FormalConjectures/Millenium/NavierStokes.lean"
    ]
  },
  "generated_at": "2026-07-30T11:08:00Z",
  "digest_contract": "sha256-canonical-json-v1",
  "snapshot_sha256": "15d86f94845fe42e57522d9cd316482f47403ee438b9d4ea7c072e29da787002",
  "statements": [
    {
      "statement_id": "FC:NavierStokes.navier_stokes_breakdown_R3",
      "theorem": "NavierStokes.navier_stokes_breakdown_R3",
      "module": "FormalConjectures.Millenium.NavierStokes",
      "source_path": "FormalConjectures/Millenium/NavierStokes.lean",
      "source_git_blob_sha1": "6fd45b55c78e49ec79f45f4e226a9b9f71f57a81",
      "category": "research open",
      "subjects": ["35"],
      "statement": "forall (nu : Real), nu > 0 -> exists u0 f, InitialVelocityConditionDecay u0 and ForceConditionDecay f and not exists v p, NavierStokesExistenceAndSmoothnessRn nu u0 f v p",
      "docstring": "(C) Breakdown of Navier-Stokes solutions on R3.",
      "formal_proof": null,
      "has_sorry_free_proof": false,
      "answer_kinds": [],
      "file_first_added": null,
      "file_last_modified": null,
      "review_state": "source-verified",
      "claim_boundary": "This record proves only that the statement was extracted from the pinned Lean source. It does not establish semantic equivalence, current status, or certification."
    },
    {
      "statement_id": "FC:NavierStokes.navier_stokes_breakdown_periodic",
      "theorem": "NavierStokes.navier_stokes_breakdown_periodic",
      "module": "FormalConjectures.Millenium.NavierStokes",
      "source_path": "FormalConjectures/Millenium/NavierStokes.lean",
      "source_git_blob_sha1": "6fd45b55c78e49ec79f45f4e226a9b9f71f57a81",
      "category": "research open",
      "subjects": ["35"],
      "statement": "forall (nu : Real), nu > 0 -> exists u0 f, InitialVelocityConditionPeriodic u0 and ForceConditionPeriodic f and not exists v p, NavierStokesExistenceAndSmoothnessPeriodic nu u0 f v p",
      "docstring": "(D) Breakdown of Navier-Stokes solutions on the three-torus.",
      "formal_proof": null,
      "has_sorry_free_proof": false,
      "answer_kinds": [],
      "file_first_added": null,
      "file_last_modified": null,
      "review_state": "source-verified",
      "claim_boundary": "This record proves only that the statement was extracted from the pinned Lean source. It does not establish semantic equivalence, current status, or certification."
    },
    {
      "statement_id": "FC:NavierStokes.navier_stokes_existence_and_smoothness_R3",
      "theorem": "NavierStokes.navier_stokes_existence_and_smoothness_R3",
      "module": "FormalConjectures.Millenium.NavierStokes",
      "source_path": "FormalConjectures/Millenium/NavierStokes.lean",
      "source_git_blob_sha1": "6fd45b55c78e49ec79f45f4e226a9b9f71f57a81",
      "category": "research open",
      "subjects": ["35"],
      "statement": "forall (nu : Real), nu > 0 -> forall (u0 : R3 -> R3), InitialVelocityConditionDecay u0 -> exists v p, NavierStokesExistenceAndSmoothnessRn nu u0 0 v p",
      "docstring": "(A) Existence and smoothness of Navier-Stokes solutions on R3.",
      "formal_proof": null,
      "has_sorry_free_proof": false,
      "answer_kinds": [],
      "file_first_added": null,
      "file_last_modified": null,
      "review_state": "source-verified",
      "claim_boundary": "This record proves only that the statement was extracted from the pinned Lean source. It does not establish semantic equivalence, current status, or certification."
    },
    {
      "statement_id": "FC:NavierStokes.navier_stokes_existence_and_smoothness_periodic",
      "theorem": "NavierStokes.navier_stokes_existence_and_smoothness_periodic",
      "module": "FormalConjectures.Millenium.NavierStokes",
      "source_path": "FormalConjectures/Millenium/NavierStokes.lean",
      "source_git_blob_sha1": "6fd45b55c78e49ec79f45f4e226a9b9f71f57a81",
      "category": "research open",
      "subjects": ["35"],
      "statement": "forall (nu : Real), nu > 0 -> forall (u0 : R3 -> R3), InitialVelocityConditionPeriodic u0 -> exists v p, NavierStokesExistenceAndSmoothnessPeriodic nu u0 0 v p",
      "docstring": "(B) Existence and smoothness of Navier-Stokes solutions on the three-torus.",
      "formal_proof": null,
      "has_sorry_free_proof": false,
      "answer_kinds": [],
      "file_first_added": null,
      "file_last_modified": null,
      "review_state": "source-verified",
      "claim_boundary": "This record proves only that the statement was extracted from the pinned Lean source. It does not establish semantic equivalence, current status, or certification."
    },
    {
      "statement_id": "FC:RiemannHypothesis.riemannHypothesis",
      "theorem": "RiemannHypothesis.riemannHypothesis",
      "module": "FormalConjectures.Millenium.RiemannHypothesis",
      "source_path": "FormalConjectures/Millenium/RiemannHypothesis.lean",
      "source_git_blob_sha1": "c8d38bef385eb15661c3daf7449625b66b019b2a",
      "category": "research open",
      "subjects": ["11"],
      "statement": "RiemannHypothesis",
      "docstring": "The Riemann Hypothesis: all non-trivial zeros of the Riemann zeta function have real part one half.",
      "formal_proof": null,
      "has_sorry_free_proof": false,
      "answer_kinds": [],
      "file_first_added": null,
      "file_last_modified": null,
      "review_state": "source-verified",
      "claim_boundary": "This record proves only that the statement was extracted from the pinned Lean source. It does not establish semantic equivalence, current status, or certification."
    }
  ],
  "non_certification_statement": "This snapshot is a source-identity and formulation artifact. Lean elaboration, upstream category labels, and sorry-free metadata do not by themselves establish truth or MATHCERT certification."
}
